{
  "schema_version": "1.0",
  "export_request_id": "req-890",
  "source_event_id": "cam01-20260625-101422",
  "redacted_export_id": "exp-123",
  "created_at": "2026-06-25T17:16:00Z",
  "redaction_status": "redaction_applied",
  "export_allowed": true,
  "redacted_frame_reference": "/safezone/exports/exp-123.jpg",
  "redaction_summary": "Masked 1 human figure and 1 license plate.",
  "hazard_region_preserved": {
    "bbox": [150, 300, 250, 450]
  },
  "original_retention_until": "2026-07-02T17:14:22Z",
  "review_status": "approved"
}
